{
  "schema": "economic_metrics_v1",
  "generated_at": "2026-03-07T17:57:48.738298+00:00",
  "kpi_eligible": true,
  "evidence_level": "real_workload",
  "tec_base_hours": 4396.3,
  "decision_count": 247,
  "avg_cost_per_decision_usd": 2669.83,
  "total_cost_internal_usd": 659448.0,
  "drift_remediation_cost_delta": 0.0,
  "patch_value_ratio": 1.0,
  "mttr_seconds": 0.030935,
  "reencrypt_records_per_second": 3232593.123,
  "reencrypt_mb_per_minute": 35329.358283,
  "evidence_sources": [
    "tec_internal.json",
    "security_metrics.json",
    "issues_all.json"
  ]
}
